{
  "fit_grade": "B",
  "fit_summary": "参考视频的抓停留和快节奏演示机制适合继续沿用，但中段演示和结果表达要按新商品重写。",
  "fit_reasoning": [
    "参考视频和目标商品都依赖直观演示建立信任",
    "原视频里的核心动作与原商品强绑定",
    "目标商品更适合真实分享语气而不是夸张广告感"
  ],
  "preserve": [
    "前 2 秒先给结果或痛点",
    "快节奏信息推进",
    "轻量 CTA 收口"
  ],
  "replace": [
    "原人物身份",
    "原品牌包装",
    "原句文案"
  ],
  "rewrite": [
    "中段演示动作",
    "结果强化镜头"
  ],
  "avoid": [
    "逐镜头高相似复刻",
    "夸张效果承诺"
  ],
  "next_action": "保留主要机制，围绕目标商品重写中段桥段和结果表达。"
}
